{
  "receipt_id": "urn:tga:receipt:authority:example",
  "receipt_type": "authority-receipt",
  "timestamp": "2026-04-27T09:00:00Z",
  "source_essays": [
    {
      "title": "The Control Plane Has Already Shifted",
      "url": "https://thetrustgraph.substack.com/p/the-control-plane-has-already-shifted",
      "publishedDate": "2026-04-13"
    },
    {
      "title": "The Commons After the Control Plane Shifts",
      "url": "https://thetrustgraph.substack.com/p/the-commons-after-the-control-plane",
      "publishedDate": "2026-04-17"
    },
    {
      "title": "Who Holds the License",
      "url": "https://thetrustgraph.substack.com/p/who-holds-the-license",
      "publishedDate": "2026-04-18"
    }
  ],
  "signature": "example-signature-placeholder",
  "authority_holder": "commons-ingestion-agent",
  "authority_source": "commons-governance-board",
  "scope": [
    "input-admission",
    "policy-enforcement"
  ],
  "validity_window": {
    "not_before": "2026-04-01T00:00:00Z",
    "not_after": "2026-07-01T00:00:00Z"
  },
  "revocation_status": "valid"
}
